{
  "featureId": "ft_ec8385daa96318cb580c6e4e3f522f9a75adad90fe80db43",
  "ruleId": "DAILY_ASTRO_MOON_SUN_CONJUNCTION",
  "source": "ASTROLOGY",
  "subject": "PERSON_A",
  "category": "EMOTION",
  "direction": "POSITIVE",
  "signedValue": 0.5,
  "rawValue": 0,
  "baseWeight": 1,
  "confidence": 1,
  "period": {
    "type": "DAY",
    "date": "2000-01-01",
    "timezone": "Asia/Tokyo"
  },
  "metadata": {
    "sampleRef": {
      "date": "2000-01-01",
      "time": "06:00",
      "timezone": "Asia/Tokyo"
    },
    "transitPlanet": "MOON",
    "natalPlanet": "SUN",
    "aspect": "CONJUNCTION",
    "orb": 0,
    "orbCloseness": 1
  }
}
